tcpdump: data link type LINUX_SLL2
tcpdump: verbose output suppressed, use -v[v]... for full protocol decode
listening on any, link-type LINUX_SLL2 (Linux cooked v2), snapshot length 262144 bytes
07:16:53.204753 lo    In  ifindex 1 00:00:00:00:00:00 ethertype IPv4 (0x0800), length 80: 127.0.0.1.53936 > 127.0.0.1.80: Flags [S], seq 1659172428, win 65495, options [mss 65495,sackOK,TS val 4055685209 ecr 0,nop,wscale 7], length 0
07:16:53.204762 lo    In  ifindex 1 00:00:00:00:00:00 ethertype IPv4 (0x0800), length 80: 127.0.0.1.80 > 127.0.0.1.53936: Flags [S.], seq 1742165602, ack 1659172429, win 65483, options [mss 65495,sackOK,TS val 4055685209 ecr 4055685209,nop,wscale 7], length 0
07:16:53.204768 lo    In  ifindex 1 00:00:00:00:00:00 ethertype IPv4 (0x0800), length 72: 127.0.0.1.53936 > 127.0.0.1.80: Flags [.], ack 1, win 512, options [nop,nop,TS val 4055685209 ecr 4055685209], length 0
07:16:53.204875 lo    In  ifindex 1 00:00:00:00:00:00 ethertype IPv4 (0x0800), length 80: 127.0.0.1.53946 > 127.0.0.1.80: Flags [S], seq 2891291746, win 65495, options [mss 65495,sackOK,TS val 4055685209 ecr 0,nop,wscale 7], length 0
07:16:53.204882 lo    In  ifindex 1 00:00:00:00:00:00 ethertype IPv4 (0x0800), length 80: 127.0.0.1.80 > 127.0.0.1.53946: Flags [S.], seq 3626412842, ack 2891291747, win 65483, options [mss 65495,sackOK,TS val 4055685209 ecr 4055685209,nop,wscale 7], length 0
07:16:53.204887 lo    In  ifindex 1 00:00:00:00:00:00 ethertype IPv4 (0x0800), length 72: 127.0.0.1.53946 > 127.0.0.1.80: Flags [.], ack 1, win 512, options [nop,nop,TS val 4055685209 ecr 4055685209], length 0
07:16:53.226945 lo    In  ifindex 1 00:00:00:00:00:00 ethertype IPv4 (0x0800), length 770: 127.0.0.1.53946 > 127.0.0.1.80: Flags [P.], seq 1:699, ack 1, win 512, options [nop,nop,TS val 4055685231 ecr 4055685209], length 698: HTTP: GET / HTTP/1.1
07:16:53.226959 lo    In  ifindex 1 00:00:00:00:00:00 ethertype IPv4 (0x0800), length 72: 127.0.0.1.80 > 127.0.0.1.53946: Flags [.], ack 699, win 507, options [nop,nop,TS val 4055685231 ecr 4055685231], length 0
07:16:53.227108 lo    In  ifindex 1 00:00:00:00:00:00 ethertype IPv4 (0x0800), length 310: 127.0.0.1.80 > 127.0.0.1.53946: Flags [P.], seq 1:239, ack 699, win 512, options [nop,nop,TS val 4055685231 ecr 4055685231], length 238: HTTP: HTTP/1.1 200 OK
07:16:53.227118 lo    In  ifindex 1 00:00:00:00:00:00 ethertype IPv4 (0x0800), length 72: 127.0.0.1.53946 > 127.0.0.1.80: Flags [.], ack 239, win 511, options [nop,nop,TS val 4055685231 ecr 4055685231], length 0
07:16:53.227132 lo    In  ifindex 1 00:00:00:00:00:00 ethertype IPv4 (0x0800), length 684: 127.0.0.1.80 > 127.0.0.1.53946: Flags [P.], seq 239:851, ack 699, win 512, options [nop,nop,TS val 4055685231 ecr 4055685231], length 612: HTTP
07:16:53.227134 lo    In  ifindex 1 00:00:00:00:00:00 ethertype IPv4 (0x0800), length 72: 127.0.0.1.53946 > 127.0.0.1.80: Flags [.], ack 851, win 507, options [nop,nop,TS val 4055685231 ecr 4055685231], length 0
07:16:53.266121 lo    In  ifindex 1 00:00:00:00:00:00 ethertype IPv4 (0x0800), length 696: 127.0.0.1.53946 > 127.0.0.1.80: Flags [P.], seq 699:1323, ack 851, win 512, options [nop,nop,TS val 4055685270 ecr 4055685231], length 624: HTTP: GET /favicon.ico HTTP/1.1
07:16:53.266145 lo    In  ifindex 1 00:00:00:00:00:00 ethertype IPv4 (0x0800), length 72: 127.0.0.1.80 > 127.0.0.1.53946: Flags [.], ack 1323, win 508, options [nop,nop,TS val 4055685270 ecr 4055685270], length 0
07:16:53.266259 lo    In  ifindex 1 00:00:00:00:00:00 ethertype IPv4 (0x0800), length 782: 127.0.0.1.80 > 127.0.0.1.53946: Flags [P.], seq 851:1561, ack 1323, win 512, options [nop,nop,TS val 4055685270 ecr 4055685270], length 710: HTTP: HTTP/1.1 404 Not Found
07:16:53.266264 lo    In  ifindex 1 00:00:00:00:00:00 ethertype IPv4 (0x0800), length 72: 127.0.0.1.53946 > 127.0.0.1.80: Flags [.], ack 1561, win 507, options [nop,nop,TS val 4055685270 ecr 4055685270], length 0
07:17:08.435309 lo    In  ifindex 1 00:00:00:00:00:00 ethertype IPv4 (0x0800), length 72: 127.0.0.1.53946 > 127.0.0.1.80: Flags [.], ack 1561, win 512, options [nop,nop,TS val 4055700440 ecr 4055685270], length 0
07:17:08.435309 lo    In  ifindex 1 00:00:00:00:00:00 ethertype IPv4 (0x0800), length 72: 127.0.0.1.53936 > 127.0.0.1.80: Flags [.], ack 1, win 512, options [nop,nop,TS val 4055700440 ecr 4055685209], length 0
07:17:08.435325 lo    In  ifindex 1 00:00:00:00:00:00 ethertype IPv4 (0x0800), length 72: 127.0.0.1.80 > 127.0.0.1.53946: Flags [.], ack 1323, win 512, options [nop,nop,TS val 4055700440 ecr 4055685270], length 0
07:17:08.435327 lo    In  ifindex 1 00:00:00:00:00:00 ethertype IPv4 (0x0800), length 72: 127.0.0.1.80 > 127.0.0.1.53936: Flags [.], ack 1, win 512, options [nop,nop,TS val 4055700440 ecr 4055685209], length 0
07:17:23.539311 lo    In  ifindex 1 00:00:00:00:00:00 ethertype IPv4 (0x0800), length 72: 127.0.0.1.53936 > 127.0.0.1.80: Flags [.], ack 1, win 512, options [nop,nop,TS val 4055715544 ecr 4055700440], length 0
07:17:23.539311 lo    In  ifindex 1 00:00:00:00:00:00 ethertype IPv4 (0x0800), length 72: 127.0.0.1.53946 > 127.0.0.1.80: Flags [.], ack 1561, win 512, options [nop,nop,TS val 4055715544 ecr 4055700440], length 0
07:17:23.539323 lo    In  ifindex 1 00:00:00:00:00:00 ethertype IPv4 (0x0800), length 72: 127.0.0.1.80 > 127.0.0.1.53936: Flags [.], ack 1, win 512, options [nop,nop,TS val 4055715544 ecr 4055685209], length 0
07:17:23.539324 lo    In  ifindex 1 00:00:00:00:00:00 ethertype IPv4 (0x0800), length 72: 127.0.0.1.80 > 127.0.0.1.53946: Flags [.], ack 1323, win 512, options [nop,nop,TS val 4055715544 ecr 4055685270], length 0
07:17:30.773304 lo    In  ifindex 1 00:00:00:00:00:00 ethertype IPv4 (0x0800), length 877: 127.0.0.1.53946 > 127.0.0.1.80: Flags [P.], seq 1323:2128, ack 1561, win 512, options [nop,nop,TS val 4055722778 ecr 4055715544], length 805: HTTP: GET / HTTP/1.1
07:17:30.773319 lo    In  ifindex 1 00:00:00:00:00:00 ethertype IPv4 (0x0800), length 72: 127.0.0.1.80 > 127.0.0.1.53946: Flags [.], ack 2128, win 506, options [nop,nop,TS val 4055722778 ecr 4055722778], length 0
07:17:30.773415 lo    In  ifindex 1 00:00:00:00:00:00 ethertype IPv4 (0x0800), length 252: 127.0.0.1.80 > 127.0.0.1.53946: Flags [P.], seq 1561:1741, ack 2128, win 512, options [nop,nop,TS val 4055722778 ecr 4055722778], length 180: HTTP: HTTP/1.1 304 Not Modified
07:17:30.773424 lo    In  ifindex 1 00:00:00:00:00:00 ethertype IPv4 (0x0800), length 72: 127.0.0.1.53946 > 127.0.0.1.80: Flags [.], ack 1741, win 511, options [nop,nop,TS val 4055722778 ecr 4055722778], length 0
07:17:38.643307 lo    In  ifindex 1 00:00:00:00:00:00 ethertype IPv4 (0x0800), length 72: 127.0.0.1.53936 > 127.0.0.1.80: Flags [.], ack 1, win 512, options [nop,nop,TS val 4055730648 ecr 4055715544], length 0
07:17:38.643326 lo    In  ifindex 1 00:00:00:00:00:00 ethertype IPv4 (0x0800), length 72: 127.0.0.1.80 > 127.0.0.1.53936: Flags [.], ack 1, win 512, options [nop,nop,TS val 4055730648 ecr 4055685209], length 0